chapter_no,section_no,section_name,id,english,urdu
chapter2,2.7,status_of_virus_in_classification,336572,Write some characteristics of viruses.,وائرسیز کی چند خصوصیات بیان کریں۔
chapter2,2.7,status_of_virus_in_classification,336573,Write a short note on prions and viroids.,پرائیوئز​​​​​​​ اور وائرئیڈ پر مختصر نوٹ لکھیں۔
chapter2,2.7,status_of_virus_in_classification,336574,From where and how coronavirus spread?,کورونا وائرس کہاں سے اور کب پھیلا؟
chapter2,2.7,status_of_virus_in_classification,336575,What are the symptoms of COVID-19?,COVID-19 کی علامات کیا ہیں؟
chapter2,2.7,status_of_virus_in_classification,336576,What preventive measures can be taken for COVID-19?,COVID-19 کے لیے کیا احتیاطی تدابیر اختیار کی جا سکتی ہیں؟
chapter2,2.8,binomial_nomenclature,336455,How does binomial nomenclature facilitate clear communication about organisms across different languages?,کس طرح بائی نومیئل نومن کلیچر مختلف زبانوں میں جانداروں کےبارے میں واضح بات چیت میں مدد فراہم کرتا ہے؟
chapter2,2.8,binomial_nomenclature,336577,Define binomial nomenclature. Also write example.,بائی نومیل نومن کلچر کی تعریف کریں اور مثال بھی لکھیں۔
chapter2,2.8,binomial_nomenclature,336578,What is the scientific name for potato and honey bee?,آلو اور شہد کی مکھی کا سائنسی نام کیا ہے؟
chapter2,2.8,binomial_nomenclature,336579,What is the significance of binomial nomenclature?,بائی نومیل نومن کلچر کی کیا اہمیت ہے؟
chapter2,2.8,binomial_nomenclature,336580,Write some rules of binomial. nomenclature.,بائی نومیل اور نومن کلچر کے کچھ قوانین لکھیں۔
chapter2,2.8,binomial_nomenclature,336581,Common names have no scientific basis. Explain.,ایک جیسے ناموں کی کوئی سائنسی بنیاد نہیں ہوتی؟بیان کریں۔
chapter2,2.8,binomial_nomenclature,336582,Various regions have different names for the same organism. Explain with examples.,مختلف علاقوں میں ایک جیسے جانداروں کے مختلف نام ہوتے ہیں۔مثالوں سے بیان کریں۔
